{
  "$schema": "https://json-schema.org/draft/2020-12/schema",
  "$id": "https://schemas.lobster-buffet.local/operations/review.update.output.v0.1.0.json",
  "title": "review.update output",
  "type": "object",
  "additionalProperties": false,
  "required": [
    "operation",
    "mode",
    "status",
    "mutates",
    "review",
    "approval",
    "side_effects",
    "adapter_capabilities",
    "preview",
    "verification",
    "warnings",
    "reason"
  ],
  "properties": {
    "operation": {
      "type": "object",
      "additionalProperties": false,
      "required": ["name", "version", "stability"],
      "properties": {
        "name": {
          "type": "string",
          "enum": ["review.update"]
        },
        "version": {
          "type": "string",
          "minLength": 1
        },
        "stability": {
          "type": "string",
          "enum": ["draft", "experimental", "stable", "deprecated"]
        }
      }
    },
    "mode": {
      "type": "string",
      "enum": ["plan", "apply"]
    },
    "status": {
      "type": "string",
      "enum": ["requires_approval", "applied"]
    },
    "mutates": {
      "type": "boolean"
    },
    "review": {
      "type": "object",
      "additionalProperties": false,
      "required": ["id", "ref_policy", "current_status", "current_apply_gate", "update_kind"],
      "properties": {
        "id": {
          "type": "string",
          "minLength": 1
        },
        "ref_policy": {
          "type": "string",
          "enum": ["opaque_ref"]
        },
        "current_status": {
          "type": "string",
          "enum": ["active", "blocked", "closed"]
        },
        "current_apply_gate": {
          "type": "string",
          "enum": ["none", "pending", "approved", "blocked"]
        },
        "target_apply_gate": {
          "type": "string",
          "enum": ["none", "pending", "approved", "blocked"]
        },
        "update_kind": {
          "type": "string",
          "enum": ["comment", "decision", "approval", "blocker", "note"]
        }
      }
    },
    "approval": {
      "type": "object",
      "additionalProperties": false,
      "required": ["required", "classes", "reason"],
      "properties": {
        "required": {
          "type": "boolean"
        },
        "classes": {
          "type": "array",
          "items": {
            "type": "string",
            "minLength": 1
          }
        },
        "reason": {
          "type": "string",
          "minLength": 1
        }
      }
    },
    "side_effects": {
      "type": "array",
      "items": {
        "type": "string",
        "enum": ["filesystem.write"]
      }
    },
    "adapter_capabilities": {
      "type": "array",
      "items": {
        "type": "string",
        "minLength": 1
      }
    },
    "preview": {
      "type": "array",
      "items": {
        "type": "object",
        "additionalProperties": false,
        "required": ["kind", "path_policy", "summary"],
        "properties": {
          "kind": {
            "type": "string",
            "minLength": 1
          },
          "path_policy": {
            "type": "string",
            "enum": ["category_only"]
          },
          "summary": {
            "type": "string",
            "minLength": 1
          }
        }
      }
    },
    "verification": {
      "type": "array",
      "items": {
        "type": "object",
        "additionalProperties": false,
        "required": ["kind", "description"],
        "properties": {
          "kind": {
            "type": "string",
            "minLength": 1
          },
          "description": {
            "type": "string",
            "minLength": 1
          }
        }
      }
    },
    "warnings": {
      "type": "array",
      "items": {
        "type": "string",
        "minLength": 1
      }
    },
    "reason": {
      "type": "string",
      "minLength": 1
    }
  }
}
